<?xml version='1.0' encoding='utf-8'?>
<list xmlns:xsi="http://www.w3.org/2001/XMLSchema-instance" xmlns="http://l2j.org" xsi:schemaLocation="http://l2j.org xsd/shop.xsd">
	<product index="100" id="5300" clan-level="3" restriction-amount="15">
		<ingredient id="95570" count="8" />
		<production id="91641" />
	</product>
	<product index="100" id="5400" clan-level="4" restriction-amount="200">
		<ingredient id="95570" count="3" />
		<production id="91690" />
	</product>
	<product index="100" id="5500" clan-level="5" restriction-amount="4">
		<ingredient id="95570" count="200" />
		<production id="95636" />
	</product>
	<product index="100" id="5501" clan-level="5" restriction-amount="10">
		<ingredient id="95570" count="2" />
		<production id="95638" />
	</product>
	<product index="100" id="5600" clan-level="6" restriction-amount="4">
		<ingredient id="95570" count="200" />
		<production id="95637" />
	</product>
</list>
