<?xml version='1.0' encoding='utf-8'?>
<list xmlns:xsi="http://www.w3.org/2001/XMLSchema-instance" xmlns="http://l2j.org" xsi:schemaLocation="http://l2j.org xsd/shop.xsd">
	<!-- Category 0 -->
	<product index="3" id="10002">
		<ingredient id="91663" count="600" />
		<production id="91767" />
	</product>
	<product index="3" id="10001">
		<ingredient id="91663" count="600" />
		<production id="92020" />
	</product>
	<!-- Category 1 -->
	<product index="3" id="10012">
		<ingredient id="91663" count="300" />
		<production id="92004" />
	</product>
	<product index="3" id="10013">
		<ingredient id="91663" count="20" />
		<production id="92005" />
	</product>
	<product index="3" id="10014">
		<ingredient id="91663" count="10" />
		<production id="91689" />
	</product>
	<product index="3" id="10042">
		<ingredient id="91663" count="10" />
		<production id="90519" />
	</product>
	<product index="3" id="10043">
		<ingredient id="91663" count="10" />
		<production id="90183" />
	</product>
	<product index="3" id="10044">
		<ingredient id="91663" count="20" />
		<production id="49081" />
	</product>
	<product index="3" id="10003">
		<ingredient id="91663" count="700" />
		<production id="90311" />
	</product>
	<!-- Category 2 -->
	<product index="3" id="10016">
		<ingredient id="57" count="4000000" />
		<production id="92004" />
	</product>
	<product index="3" id="10017">
		<ingredient id="57" count="4000000" />
		<production id="92005" />
	</product>
	<product index="3" id="10018">
		<ingredient id="91663" count="2000" />
		<production id="92006" />
	</product>
	<product index="3" id="10019">
		<ingredient id="91663" count="2000" />
		<production id="92007" />
	</product>
	<product index="3" id="10020">
		<ingredient id="91663" count="2000" />
		<production id="92008" />
	</product>
	<product index="3" id="10021">
		<ingredient id="91663" count="4000" />
		<production id="91032" />
	</product>
	<product index="3" id="10022">
		<ingredient id="91663" count="4000" />
		<production id="91033" />
	</product>
	<product index="3" id="10023">
		<ingredient id="91663" count="4000" />
		<production id="91034" />
	</product>
	<product index="3" id="10024">
		<ingredient id="91663" count="4000" />
		<production id="91031" />
	</product>
	<product index="3" id="10065">
		<ingredient id="91663" count="10000" />
		<production id="32254" />
	</product>
	<product index="3" id="10025">
		<ingredient id="91663" count="5000" />
		<production id="32253" />
	</product>
	<product index="3" id="10026">
		<ingredient id="91663" count="1000" />
		<production id="32252" />
	</product>
	<product index="3" id="10027">
		<ingredient id="91663" count="400" />
		<production id="32251" />
	</product>
	<product index="3" id="10028">
		<ingredient id="91663" count="200" />
		<production id="32250" />
	</product>
	<!-- Category 3 -->
	<product index="3" id="10067" restriction-amount="1">
		<ingredient id="57" count="2000000" />
		<production id="91767" />
	</product>
	<product index="3" id="10066" restriction-amount="1">
		<ingredient id="57" count="2000000" />
		<production id="92020" />
	</product>
	<product index="3" id="10068" restriction-amount="1">
		<ingredient id="57" count="30000000" />
		<production id="94208" />
	</product>
	<product index="3" id="10071" restriction-amount="10">
		<ingredient id="57" count="200000" />
		<production id="94377" />
	</product>
	<!-- Category 4 -->
	<product index="3" id="10038" restriction-amount="1" expiration-date="2021-05-18 00:00:00">
		<ingredient id="57" count="100000" />
		<production id="71314" />
	</product>
</list>
